{
  "language": "id",
  "language_name": "Indonesian",
  "timeline": [
    {
      "key": "creation",
      "event": "Penciptaan",
      "reference": "Kejadian 1:1",
      "estimated_year": -4000,
      "category": "creation"
    },
    {
      "key": "adam_eve",
      "event": "Penciptaan Adam dan Hawa",
      "reference": "Kejadian 2:7-25",
      "estimated_year": -4000,
      "category": "creation"
    },
    {
      "key": "fall",
      "event": "Kejatuhan",
      "reference": "Kejadian 3:1-24",
      "estimated_year": -3990,
      "category": "creation"
    },
    {
      "key": "cain_abel",
      "event": "Kain dan Habel",
      "reference": "Kejadian 4:1-16",
      "estimated_year": -3980,
      "category": "creation"
    },
    {
      "key": "flood",
      "event": "Air Bah yang Besar",
      "reference": "Kejadian 6-9",
      "estimated_year": -2500,
      "category": "major_event"
    },
    {
      "key": "babel",
      "event": "Menara Babel",
      "reference": "Kejadian 11:1-9",
      "estimated_year": -2200,
      "category": "major_event"
    },
    {
      "key": "abraham_call",
      "event": "Pemanggilan Abraham",
      "reference": "Kejadian 12:1-9",
      "estimated_year": -2000,
      "category": "patriarchs"
    },
    {
      "key": "abraham_sacrifice",
      "event": "Abraham Hampir Mendatangkan Ishak",
      "reference": "Kejadian 22:1-19",
      "estimated_year": -1980,
      "category": "patriarchs"
    },
    {
      "key": "isaac_birth",
      "event": "Kelahiran Ishak",
      "reference": "Kejadian 21:1-7",
      "estimated_year": -1960,
      "category": "patriarchs"
    },
    {
      "key": "jacob_esau",
      "event": "Yakub dan Esau",
      "reference": "Kejadian 25-36",
      "estimated_year": -1900,
      "category": "patriarchs"
    },
    {
      "key": "joseph_dream",
      "event": "Mimpi Yusuf",
      "reference": "Kejadian 37:1-11",
      "estimated_year": -1850,
      "category": "patriarchs"
    },
    {
      "key": "joseph_slavery",
      "event": "Yusuf Dijual Menjadi Hamba",
      "reference": "Kejadian 37:12-36",
      "estimated_year": -1840,
      "category": "patriarchs"
    },
    {
      "key": "joseph_egypt",
      "event": "Yusuf Meningkat di Mesir",
      "reference": "Kejadian 39-41",
      "estimated_year": -1830,
      "category": "patriarchs"
    },
    {
      "key": "joseph_reunion",
      "event": "Yusuf Bersatu Kembali dengan Keluarga",
      "reference": "Kejadian 42-50",
      "estimated_year": -1800,
      "category": "patriarchs"
    },
    {
      "key": "exodus",
      "event": "Keluar dari Mesir",
      "reference": "Keluaran 12:37-51",
      "estimated_year": -1446,
      "category": "patriarchs"
    },
    {
      "key": "red_sea",
      "event": "Laut Merah Terbelah",
      "reference": "Keluaran 14",
      "estimated_year": -1446,
      "category": "patriarchs"
    },
    {
      "key": "sinai_law",
      "event": "Pemberian Hukum di Sinai",
      "reference": "Keluaran 19-20",
      "estimated_year": -1446,
      "category": "patriarchs"
    },
    {
      "key": "tabernacle",
      "event": "Pembuatan Kemah Suci",
      "reference": "Keluaran 25-40",
      "estimated_year": -1445,
      "category": "patriarchs"
    },
    {
      "key": "spies",
      "event": "Pengintai Dikirim ke Kanaan",
      "reference": "Bilangan 13",
      "estimated_year": -1430,
      "category": "wilderness"
    },
    {
      "key": "wandering",
      "event": "40 Tahun Mengembara di Padang",
      "reference": "Bilangan 14:26-35",
      "estimated_year": -1430,
      "category": "wilderness"
    },
    {
      "key": "balaam",
      "event": "Nubuat Balaam",
      "reference": "Bilangan 22-24",
      "estimated_year": -1407,
      "category": "wilderness"
    },
    {
      "key": "joshua_leadership",
      "event": "Yusua Memimpin Israel",
      "reference": "Yosua 1",
      "estimated_year": -1406,
      "category": "history"
    },
    {
      "key": "jericho",
      "event": "Yerikho Jatuh",
      "reference": "Yosua 6",
      "estimated_year": -1406,
      "category": "history"
    },
    {
      "key": "conquest",
      "event": "Penaklukan Kanaan",
      "reference": "Yosua 10-12",
      "estimated_year": -1406,
      "category": "history"
    },
    {
      "key": "judges_cycle",
      "event": "Siklus Para Hakim",
      "reference": "Hakim-Hakim 2:10-23",
      "estimated_year": -1380,
      "category": "history"
    },
    {
      "key": "samson",
      "event": "Kisah Samson",
      "reference": "Hakim-Hakim 13-16",
      "estimated_year": -1100,
      "category": "history"
    },
    {
      "key": "ruth",
      "event": "Kisah Rut",
      "reference": "Rut 1-4",
      "estimated_year": -1150,
      "category": "history"
    },
    {
      "key": "samuel_call",
      "event": "Panggilan Samuel",
      "reference": "1 Samuel 3",
      "estimated_year": -1100,
      "category": "monarchy"
    },
    {
      "key": "saul_king",
      "event": "Saul Menjadi Raja Pertama",
      "reference": "1 Samuel 10:1-25",
      "estimated_year": -1050,
      "category": "monarchy"
    },
    {
      "key": "saul_rejected",
      "event": "Saul Ditolak sebagai Raja",
      "reference": "1 Samuel 15:10-35",
      "estimated_year": -1040,
      "category": "monarchy"
    },
    {
      "key": "david_anointed",
      "event": "Daud Dianugerahi",
      "reference": "1 Samuel 16:1-13",
      "estimated_year": -1030,
      "category": "monarchy"
    },
    {
      "key": "david_goliath",
      "event": "Daud Melawan Goliat",
      "reference": "1 Samuel 17",
      "estimated_year": -1030,
      "category": "monarchy"
    },
    {
      "key": "david_saul_friendship",
      "event": "Persahabatan Daud dan Yonatan",
      "reference": "1 Samuel 18:1-4",
      "estimated_year": -1030,
      "category": "monarchy"
    },
    {
      "key": "david_king_judah",
      "event": "Daud Menjadi Raja atas Yehuda",
      "reference": "2 Samuel 2:1-7",
      "estimated_year": -1010,
      "category": "monarchy"
    },
    {
      "key": "david_king_all_israel",
      "event": "Daud Menjadi Raja atas Seluruh Israel",
      "reference": "2 Samuel 5:1-5",
      "estimated_year": -1003,
      "category": "monarchy"
    },
    {
      "key": "ark_transferred",
      "event": "Tabut Dibawa ke Yerusalem",
      "reference": "2 Samuel 6",
      "estimated_year": -1000,
      "category": "monarchy"
    },
    {
      "key": "david_covenant",
      "event": "Perjanjian Daud",
      "reference": "2 Samuel 7:8-17",
      "estimated_year": -990,
      "category": "monarchy"
    },
    {
      "key": "temple_solomon",
      "event": "Pembuatan Bait Allah oleh Sulaiman",
      "reference": "1 Raja-raja 6",
      "estimated_year": -966,
      "category": "monarchy"
    },
    {
      "key": "solomon_wisdom",
      "event": "Kebijaksanaan Sulaiman",
      "reference": "1 Raja-raja 3:1-15",
      "estimated_year": -971,
      "category": "monarchy"
    },
    {
      "key": "queen_sheba",
      "event": "Ratu Sheba Mengunjungi",
      "reference": "1 Raja-raja 10:1-13",
      "estimated_year": -950,
      "category": "monarchy"
    },
    {
      "key": "kingdom_split",
      "event": "Kerajaan Terbelah",
      "reference": "1 Raja-raja 12:1-24",
      "estimated_year": -931,
      "category": "monarchy"
    },
    {
      "key": "elijah_ministry",
      "event": "Ministry Elia",
      "reference": "1 Raja-raja 17-19",
      "estimated_year": -870,
      "category": "kingdom"
    },
    {
      "key": "carmel_showdown",
      "event": "Kontes di Gunung Karmel",
      "reference": "1 Raja-raja 18",
      "estimated_year": -870,
      "category": "kingdom"
    },
    {
      "key": "naaman_healing",
      "event": "Penyembuhan Naaman",
      "reference": "2 Raja-raja 5",
      "estimated_year": -850,
      "category": "kingdom"
    },
    {
      "key": "jonah_nineveh",
      "event": "Yunus dan Niniwe",
      "reference": "Yunus 1-4",
      "estimated_year": -760,
      "category": "kingdom"
    },
    {
      "key": "amos_prophecy",
      "event": "Nubuat Amos",
      "reference": "Amos 1-9",
      "estimated_year": -760,
      "category": "kingdom"
    },
    {
      "key": "hosea_marriage",
      "event": "Perkawinan Hosea",
      "reference": "Hosea 1-3",
      "estimated_year": -755,
      "category": "kingdom"
    },
    {
      "key": "israel_exile",
      "event": "Pembuangan Israel oleh Asyur",
      "reference": "2 Raja-raja 17",
      "estimated_year": -722,
      "category": "exile"
    },
    {
      "key": "hezekiah_reform",
      "event": "Reformasi Hizkia",
      "reference": "2 Raja-raja 18:1-8",
      "estimated_year": -715,
      "category": "kingdom"
    },
    {
      "key": "senacherib",
      "event": "Invasi Sanherib",
      "reference": "2 Raja-raja 18:17-37",
      "estimated_year": -701,
      "category": "kingdom"
    },
    {
      "key": "josiah_reform",
      "event": "Reformasi Yosia",
      "reference": "2 Raja-raja 22:1-23:30",
      "estimated_year": -640,
      "category": "kingdom"
    },
    {
      "key": "jeremiah_ministry",
      "event": "Ministry Yeremia",
      "reference": "Yeremia 1:1-19",
      "estimated_year": -627,
      "category": "kingdom"
    },
    {
      "key": "judah_exile",
      "event": "Pembuangan Yehuda oleh Babilonia",
      "reference": "2 Raja-raja 25",
      "estimated_year": -586,
      "category": "exile"
    },
    {
      "key": "jeremiah_lament",
      "event": "Ratapan Yeremia",
      "reference": "Ratapan 1-5",
      "estimated_year": -586,
      "category": "exile"
    },
    {
      "key": "ezekiel_exile",
      "event": "Nubuat Yehezkiel",
      "reference": "Yehezkiel 1-48",
      "estimated_year": -573,
      "category": "exile"
    },
    {
      "key": "daniel_lions",
      "event": "Daniel dalam Gua Singa",
      "reference": "Daniel 6",
      "estimated_year": -539,
      "category": "exile"
    },
    {